{
  "urn": "${urn}",
  "prosecutingAuthority": "TFL",
  "costs": 1.23,
  "dateTimeCreated": "${dateTimeCreated}",
  "defendant": {
    "speakWelsh": false,
    "offences": [
      {
        "sequenceNumber": 1,
        "prosecutionFacts": "No ticket at the gates, forgery",
        "offenceCode": "PS00001",
        "cjsCode": "PS00001",
        "pendingWithdrawal": false,
        "hasFinalDecision": false,
        "pleaMethod": "ONLINE",
        "pleaDate": "${pleaDate}",
        "compensation": 2.34,
        "id": "${offenceId}",
        "plea": "NOT_GUILTY",
        "offenceSequenceNumber": 1,
        "wording": "Committed some offence",
        "chargeDate": "2016-01-01",
        "startDate": "2016-01-01",
        "title": "Postal service - convey a letter without a licence",
        "legislation": "Contrary to section 6(2) of the Postal Services Act 2000.",
        "notInEffect": true,
        "outOfTime": false,
        "imprisonable": true,
        "maxFineLevel": "S"
      }
    ],
    "caseId": "${caseId}",
    "numPreviousConvictions": 2,
    "personalDetails": {
      "firstName": "Testy",
      "lastName": "Testerson",
      "address": {
        "address1": "14 Tottenham Court Road",
        "address2": "London",
        "address3": "England",
        "address4": "UK",
        "address5": "Greater London",
        "postcode": "W1T 1JY"
      },
      "gender": "Male",
      "nationalInsuranceNumber": "AB123456A",
      "addressChanged": false,
      "dateOfBirth": "1990-09-09",
      "title": "Mr",
      "contactDetails": {
        "mobile": "07890123123",
        "email": "criminal@gmail.com",
        "home": "0208000888"
      },
      "dobChanged": true,
      "nameChanged": true
    },
    "interpreter": {
      "needed": true,
      "language": "French"
    },
    "id": "${defendantId}"
  },
  "caseDocuments": [
  ],
  "caseDecisions": [

  ],
  "listedInCriminalCourts": false,
  "assigned": false,
  "id": "${caseId}",
  "completed": false,
  "postingDate": "2015-12-02",
  "enterpriseId": "${enterpriseId}",
  "onlinePleaReceived": true,
  "status": "${caseStatus}"
}
